{
  "contractVersion": "1",
  "status": "ok",
  "differential": {
    "likely": [
      { "icd10": "K35.8", "label": "Acute appendicitis", "confidenceTier": "high", "score": 0.82 }
    ],
    "alternatives": [
      { "icd10": "A09", "label": "Infectious gastroenteritis", "confidenceTier": "low" },
      { "icd10": "N10", "label": "Acute pyelonephritis", "confidenceTier": "low" }
    ],
    "cannotMiss": [{ "icd10": "K65.0", "label": "Acute peritonitis", "confidenceTier": "low" }]
  },
  "evidence": [
    {
      "icd10": "K35.8",
      "supporting": ["pain migrating from periumbilical area to right lower quadrant"],
      "opposing": []
    },
    { "icd10": "N10", "supporting": [], "opposing": ["no dysuria, no flank pain"] }
  ],
  "missingInformation": ["duration of fever"],
  "nextBestActions": [
    { "kind": "exam", "item": "Rovsing sign", "reason": "supports appendicitis if positive" },
    {
      "kind": "test",
      "item": "complete blood count",
      "reason": "leukocytosis supports inflammation"
    }
  ],
  "disposition": { "decision": "refer", "urgency": "urgent" },
  "unfilled": [],
  "meta": { "version": "example-service-0.0", "model": null, "costUsd": null }
}
